{
  "$schema": "../../../../benchmark-kit/schemas/guided-observations.schema.json",
  "schemaVersion": 1,
  "kind": "benchmark-guided-observations",
  "id": "ilovepdf-healthy-controls-2026-08-11",
  "toolId": "ilovepdf-repair-pdf-web-2026-08-11",
  "cases": [
    {
      "caseId": "pdf-healthy-no-repair",
      "productOutcome": "refusal",
      "attemptedAt": "2026-08-11T17:46:40Z",
      "productMessage": "Oh no! We couldn't process your files. This file has not been processed because it was damaged or we were unable to read it.",
      "operatorNote": "iLovePDF accepted the intact PDF but displayed its Damaged/Corrupted File error page and produced no output.",
      "attachments": [
        "healthy/attachments/01-upload.png",
        "healthy/attachments/02-ready.png",
        "healthy/attachments/03-refusal.png"
      ]
    },
    {
      "caseId": "jpeg-healthy-no-repair",
      "productOutcome": "unavailable",
      "attemptedAt": "2026-08-11T17:46:40Z",
      "productMessage": "Repair PDF accepts PDF files only.",
      "operatorNote": "Unsupported product scope; not a technical recovery failure.",
      "accessConstraint": {
        "kind": "format-not-supported",
        "stage": "before-upload",
        "scope": "case"
      }
    },
    {
      "caseId": "png-healthy-no-repair",
      "productOutcome": "unavailable",
      "attemptedAt": "2026-08-11T17:46:40Z",
      "productMessage": "Repair PDF accepts PDF files only.",
      "operatorNote": "Unsupported product scope; not a technical recovery failure.",
      "accessConstraint": {
        "kind": "format-not-supported",
        "stage": "before-upload",
        "scope": "case"
      }
    },
    {
      "caseId": "zip-healthy-no-repair",
      "productOutcome": "unavailable",
      "attemptedAt": "2026-08-11T17:46:40Z",
      "productMessage": "Repair PDF accepts PDF files only.",
      "operatorNote": "Unsupported product scope; not a technical recovery failure.",
      "accessConstraint": {
        "kind": "format-not-supported",
        "stage": "before-upload",
        "scope": "case"
      }
    }
  ]
}
