{
  "$schema": "../../../../benchmark-kit/schemas/guided-observations.schema.json",
  "schemaVersion": 1,
  "kind": "benchmark-guided-observations",
  "id": "easeus-healthy-controls-2026-08-11",
  "toolId": "easeus-online-repair-web-2026-08-11",
  "cases": [
    {
      "caseId": "pdf-healthy-no-repair",
      "productOutcome": "unavailable",
      "attemptedAt": "2026-08-11T17:48:46Z",
      "productMessage": "Sign in to EaseUS Fixo.",
      "operatorNote": "EaseUS accepted the intact PDF and labeled it 'Damaged file detected', but required an account when repair was requested. No technical result or score is claimed.",
      "accessConstraint": {
        "kind": "account-required",
        "stage": "before-processing",
        "scope": "product-path",
        "note": "The false damage diagnosis is preserved as an observation, but the account gate keeps the case unscored."
      },
      "attachments": [
        "healthy/attachments/01-upload.png",
        "healthy/attachments/02-false-damage.png",
        "healthy/attachments/03-account-gate.png"
      ]
    },
    {
      "caseId": "jpeg-healthy-no-repair",
      "productOutcome": "unavailable",
      "attemptedAt": "2026-08-11T17:48:46Z",
      "productMessage": "Sign in to EaseUS Fixo.",
      "operatorNote": "Not uploaded after the same-day photo-repair path had already established the same account requirement before processing; no technical result is claimed.",
      "accessConstraint": {
        "kind": "account-required",
        "stage": "before-processing",
        "scope": "product-path"
      },
      "attachments": ["attachments/photo-account-gate.png"]
    },
    {
      "caseId": "png-healthy-no-repair",
      "productOutcome": "unavailable",
      "attemptedAt": "2026-08-11T17:48:46Z",
      "productMessage": "Sign in to EaseUS Fixo.",
      "operatorNote": "Not uploaded after the same-day photo-repair path had already established the same account requirement before processing; no technical result is claimed.",
      "accessConstraint": {
        "kind": "account-required",
        "stage": "before-processing",
        "scope": "product-path"
      },
      "attachments": ["attachments/photo-account-gate.png"]
    },
    {
      "caseId": "zip-healthy-no-repair",
      "productOutcome": "unavailable",
      "attemptedAt": "2026-08-11T17:48:46Z",
      "productMessage": "Sign in to EaseUS Fixo.",
      "operatorNote": "Not uploaded after the healthy PDF established an account requirement on the same document-and-archive repair path; no technical result is claimed.",
      "accessConstraint": {
        "kind": "account-required",
        "stage": "before-processing",
        "scope": "product-path"
      },
      "attachments": ["healthy/attachments/03-account-gate.png"]
    }
  ]
}
