{
  "$schema": "../../../../benchmark-kit/schemas/guided-observations.schema.json",
  "schemaVersion": 1,
  "kind": "benchmark-guided-observations",
  "id": "repairit-practice-observations-2026-08-11",
  "toolId": "repairit-online-repair-web-2026-08-11",
  "cases": [
    {
      "caseId": "pdf-full-missing-eof",
      "productOutcome": "unavailable",
      "attemptedAt": "2026-08-11T16:49:05Z",
      "productMessage": "The File Repair feature is temporarily unavailable due to maintenance. Please use the desktop application to process your files.",
      "operatorNote": "No desktop software was downloaded for this browser-only rehearsal.",
      "accessConstraint": {
        "kind": "service-maintenance",
        "stage": "before-upload",
        "scope": "product-path",
        "note": "The vendor directed users to its desktop application; this benchmark did not install software."
      },
      "attachments": ["attachments/file-repair-maintenance.png"]
    },
    {
      "caseId": "pdf-partial-truncated-stream",
      "productOutcome": "unavailable",
      "attemptedAt": "2026-08-11T16:49:05Z",
      "productMessage": "The File Repair feature is temporarily unavailable due to maintenance. Please use the desktop application to process your files.",
      "operatorNote": "The maintenance state applied to the online file-repair path; no technical attempt or score is claimed.",
      "accessConstraint": {
        "kind": "service-maintenance",
        "stage": "before-upload",
        "scope": "product-path"
      }
    },
    {
      "caseId": "jpeg-full-corrupt-segment-length",
      "productOutcome": "success",
      "attemptedAt": "2026-08-11T16:50:05Z",
      "productMessage": "Successful",
      "operatorNote": "Repairit returned two complete candidates. Candidate 1 is the deterministic primary output; candidate 2 and the untouched Download All archive are retained as attachments. Both candidates independently decode to the same benchmark score.",
      "outputPath": "outputs/full-corrupt-app0-length_1.jpg",
      "attachments": [
        "outputs/full-corrupt-app0-length_2.jpg",
        "attachments/raw-download-all.zip",
        "attachments/photo-results.png"
      ]
    },
    {
      "caseId": "jpeg-partial-corrupt-entropy",
      "productOutcome": "success",
      "attemptedAt": "2026-08-11T16:50:05Z",
      "productMessage": "Successful",
      "operatorNote": "Repairit returned two complete candidates. Candidate 1 is the deterministic primary output and candidate 2 is retained as an attachment; both independently decode to the same benchmark score.",
      "outputPath": "outputs/partial-corrupt-entropy_1.jpg",
      "attachments": ["outputs/partial-corrupt-entropy_2.jpg"]
    },
    {
      "caseId": "png-full-missing-iend",
      "productOutcome": "success",
      "attemptedAt": "2026-08-11T16:50:05Z",
      "productMessage": "Successful",
      "operatorNote": "The Download All archive contained one complete PNG result.",
      "outputPath": "outputs/full-missing-iend.png"
    },
    {
      "caseId": "png-partial-truncated-idat",
      "productOutcome": "unavailable",
      "attemptedAt": "2026-08-11T16:51:10Z",
      "productMessage": "Repairit Online Free: Repair up to 3 photos.",
      "operatorNote": "The free browser path had admitted three photos and no longer exposed an add-photo control after completion. The fourth case was not admitted and the quota was not circumvented.",
      "accessConstraint": {
        "kind": "free-tier-quota",
        "stage": "before-upload",
        "scope": "session",
        "limit": {
          "maximum": 3,
          "unit": "photos"
        },
        "note": "The free allowance was exhausted after the three earlier image cases."
      }
    },
    {
      "caseId": "zip-full-missing-directory",
      "productOutcome": "unavailable",
      "attemptedAt": "2026-08-11T16:49:05Z",
      "productMessage": "The File Repair feature is temporarily unavailable due to maintenance. Please use the desktop application to process your files.",
      "operatorNote": "The maintenance state applied to the online file-repair path; no technical attempt or score is claimed.",
      "accessConstraint": {
        "kind": "service-maintenance",
        "stage": "before-upload",
        "scope": "product-path",
        "note": "Repairit's primary online file page advertises PDF and Office formats but not ZIP; its desktop offer advertises ZIP. The unavailable page prevented an online upload attempt."
      }
    },
    {
      "caseId": "zip-partial-truncated-deflate",
      "productOutcome": "unavailable",
      "attemptedAt": "2026-08-11T16:49:05Z",
      "productMessage": "The File Repair feature is temporarily unavailable due to maintenance. Please use the desktop application to process your files.",
      "operatorNote": "The maintenance state applied to the online file-repair path; no technical attempt or score is claimed.",
      "accessConstraint": {
        "kind": "service-maintenance",
        "stage": "before-upload",
        "scope": "product-path",
        "note": "Repairit's primary online file page advertises PDF and Office formats but not ZIP; its desktop offer advertises ZIP. The unavailable page prevented an online upload attempt."
      }
    }
  ]
}
