{
  "$schema": "../../../../benchmark-kit/schemas/guided-observations.schema.json",
  "schemaVersion": 1,
  "kind": "benchmark-guided-observations",
  "id": "ilovepdf-practice-observations-2026-08-11",
  "toolId": "ilovepdf-repair-pdf-web-2026-08-11",
  "cases": [
    {
      "caseId": "pdf-full-missing-eof",
      "productOutcome": "refusal",
      "attemptedAt": "2026-08-11T16:46:35Z",
      "productMessage": "Oh no! We couldn't process your files. This file has not been processed because it was damaged or we were unable to read it.",
      "operatorNote": "The product displayed its Damaged/Corrupted File error page and produced no output."
    },
    {
      "caseId": "pdf-partial-truncated-stream",
      "productOutcome": "refusal",
      "attemptedAt": "2026-08-11T16:47:05Z",
      "productMessage": "Oh no! We couldn't process your files. This file has not been processed because it was damaged or we were unable to read it.",
      "operatorNote": "The product displayed its Damaged/Corrupted File error page and produced no output.",
      "attachments": ["attachments/pdf-partial-refusal.png"]
    },
    {
      "caseId": "jpeg-full-corrupt-segment-length",
      "productOutcome": "unavailable",
      "attemptedAt": "2026-08-11T16:47:10Z",
      "productMessage": "Repair PDF accepts PDF files only.",
      "operatorNote": "Unsupported product scope; not a technical recovery failure.",
      "accessConstraint": {
        "kind": "format-not-supported",
        "stage": "before-upload",
        "scope": "case"
      }
    },
    {
      "caseId": "jpeg-partial-corrupt-entropy",
      "productOutcome": "unavailable",
      "attemptedAt": "2026-08-11T16:47:10Z",
      "productMessage": "Repair PDF accepts PDF files only.",
      "operatorNote": "Unsupported product scope; not a technical recovery failure.",
      "accessConstraint": {
        "kind": "format-not-supported",
        "stage": "before-upload",
        "scope": "case"
      }
    },
    {
      "caseId": "png-full-missing-iend",
      "productOutcome": "unavailable",
      "attemptedAt": "2026-08-11T16:47:10Z",
      "productMessage": "Repair PDF accepts PDF files only.",
      "operatorNote": "Unsupported product scope; not a technical recovery failure.",
      "accessConstraint": {
        "kind": "format-not-supported",
        "stage": "before-upload",
        "scope": "case"
      }
    },
    {
      "caseId": "png-partial-truncated-idat",
      "productOutcome": "unavailable",
      "attemptedAt": "2026-08-11T16:47:10Z",
      "productMessage": "Repair PDF accepts PDF files only.",
      "operatorNote": "Unsupported product scope; not a technical recovery failure.",
      "accessConstraint": {
        "kind": "format-not-supported",
        "stage": "before-upload",
        "scope": "case"
      }
    },
    {
      "caseId": "zip-full-missing-directory",
      "productOutcome": "unavailable",
      "attemptedAt": "2026-08-11T16:47:10Z",
      "productMessage": "Repair PDF accepts PDF files only.",
      "operatorNote": "Unsupported product scope; not a technical recovery failure.",
      "accessConstraint": {
        "kind": "format-not-supported",
        "stage": "before-upload",
        "scope": "case"
      }
    },
    {
      "caseId": "zip-partial-truncated-deflate",
      "productOutcome": "unavailable",
      "attemptedAt": "2026-08-11T16:47:10Z",
      "productMessage": "Repair PDF accepts PDF files only.",
      "operatorNote": "Unsupported product scope; not a technical recovery failure.",
      "accessConstraint": {
        "kind": "format-not-supported",
        "stage": "before-upload",
        "scope": "case"
      }
    }
  ]
}
